CODE;ENGLISH;FRENCH;GERMAN;;SPANISH;;;;;;;;;x
hoa_enter_shadowfang_keep;Enter Shadowfang Keep;Entrer dans Shadowfang Keep;Shadowfang Keep betreten;;Entrar en Shadowfang Keep;;;;;;;;;x
hoa_enter_shadowfang_keep_desc;Lead an expedition into Shadowfang Keep in Silverpine Forest to face its cursed inhabitants.;Mener une expedition dans Shadowfang Keep en foret de Pins-Argentes pour affronter ses habitants maudits.;Eine Expedition in Shadowfang Keep fuhren.;;Liderar una expedicion a Shadowfang Keep.;;;;;;;;;x
hoa_enter_scarlet_monastery;Enter Scarlet Monastery;Entrer au Monastere Ecarlate;Scharlachrotes Kloster betreten;;Entrar al Monasterio Escarlata;;;;;;;;;x
hoa_enter_scarlet_monastery_desc;Storm the Scarlet Monastery in Tirisfal Glades. The Scarlet Crusade's fanatics await.;Prendre d'assaut le Monastere Ecarlate dans les Clairires de Tirisfal. Les fanatiques de la Croisade Ecarlate attendent.;Das Scharlachrote Kloster sturmen.;;Asaltar el Monasterio Escarlata.;;;;;;;;;x
hoa_enter_gnomeregan;Enter Gnomeregan;Entrer dans Gnomeregan;Gnomeregan betreten;;Entrar en Gnomeregan;;;;;;;;;x
hoa_enter_gnomeregan_desc;Descend into the irradiated halls of Gnomeregan to face Mekgineer Thermaplugg.;Descendre dans les salles irradiees de Gnomeregan pour affronter Mekgineur Thermaplugg.;In die verstrahlten Hallen von Gnomeregan hinabsteigen.;;Descender a las salas irradiadas de Gnomeregan.;;;;;;;;;x
hoa_enter_maraudon;Enter Maraudon;Entrer dans Maraudon;Maraudon betreten;;Entrar en Maraudon;;;;;;;;;x
hoa_enter_maraudon_desc;Explore the sacred caverns of Maraudon in Desolace to face Princess Theradras.;Explorer les cavernes sacrees de Maraudon en Desolace pour affronter la Princesse Theradras.;Die heiligen Hohlen von Maraudon erkunden.;;Explorar las cavernas sagradas de Maraudon.;;;;;;;;;x
hoa_enter_dire_maul;Enter Dire Maul;Entrer dans Hache-Tripes;Dusterbruch betreten;;Entrar en Dire Maul;;;;;;;;;x
hoa_enter_dire_maul_desc;Venture into the ancient Highborne ruins of Dire Maul in Feralas.;S'aventurer dans les ruines antiques des Bien-Nes de Hache-Tripes a Feralas.;Die alten Ruinen von Dusterbruch erkunden.;;Aventurarse en las ruinas de Dire Maul.;;;;;;;;;x
hoa_enter_stratholme;Enter Stratholme;Entrer dans Stratholme;Stratholme betreten;;Entrar en Stratholme;;;;;;;;;x
hoa_enter_stratholme_desc;Brave the undead-infested streets of Stratholme to face Baron Rivendare.;Affronter les rues infestees de morts-vivants de Stratholme pour defier le Baron Vaillefendre.;Die untoten Strassen von Stratholme betreten.;;Desafiar las calles de Stratholme.;;;;;;;;;x
hoa_enter_scholomance;Enter Scholomance;Entrer dans la Scholomance;Scholomance betreten;;Entrar en Scholomance;;;;;;;;;x
hoa_enter_scholomance_desc;Infiltrate the necromancy school of Scholomance on Caer Darrow island.;Infiltrer l'ecole de necromancie de Scholomance sur l'ile de Caer Darrow.;Die Nekromantieschule Scholomance infiltrieren.;;Infiltrar la escuela de nigromancia.;;;;;;;;;x
hoa_enter_upper_blackrock;Enter Upper Blackrock Spire;Entrer dans le Pic Blackrock Superieur;Obere Blackrock Spitze betreten;;Entrar en Cumbre de Roca Negra Superior;;;;;;;;;x
hoa_enter_upper_blackrock_desc;Assault the Upper Blackrock Spire to face Warchief Rend Blackhand.;Assaut du Pic Blackrock Superieur pour affronter le Chef de Guerre Rend Main-Noire.;Die Obere Blackrock Spitze sturmen.;;Asaltar la Cumbre Superior de Roca Negra.;;;;;;;;;x
hoa_enter_zulgurub;Enter Zul'Gurub;Entrer dans Zul'Gurub;Zul'Gurub betreten;;Entrar en Zul'Gurub;;;;;;;;;x
hoa_enter_zulgurub_desc;Lead a warband into the ancient troll city of Zul'Gurub to face Hakkar the Soulflayer.;Mener une bande de guerre dans l'ancienne cite troll de Zul'Gurub pour affronter Hakkar l'Ecorcheur d'Ames.;Eine Kriegsgruppe nach Zul'Gurub fuhren.;;Liderar un grupo de guerra a Zul'Gurub.;;;;;;;;;x
hoa_enter_molten_core;Enter the Molten Core;Entrer dans le Coeur du Magma;Den Geschmolzenen Kern betreten;;Entrar al Nucleo de Magma;;;;;;;;;x
hoa_enter_molten_core_desc;Lead a massive expedition into the Molten Core beneath Blackrock Mountain to face Ragnaros the Firelord. This is extremely dangerous.;Mener une expedition massive dans le Coeur du Magma sous la Montagne Blackrock pour affronter Ragnaros le Seigneur du Feu. Extremement dangereux.;Eine massive Expedition in den Geschmolzenen Kern fuhren. Extrem gefahrlich.;;Liderar una expedicion masiva al Nucleo de Magma. Extremadamente peligroso.;;;;;;;;;x
hoa_enter_blackwing_lair;Enter Blackwing Lair;Entrer dans le Repaire de l'Aile Noire;Pechschwingenhort betreten;;Entrar en la Guarida Alanegra;;;;;;;;;x
hoa_enter_blackwing_lair_desc;Only those who have defeated Ragnaros may challenge Nefarian in his lair. The black dragonflight awaits.;Seuls ceux qui ont vaincu Ragnaros peuvent defier Nefarian dans son repaire. Le vol draconique noir attend.;Nur wer Ragnaros bezwungen hat darf Nefarian herausfordern.;;Solo quienes derrotaron a Ragnaros pueden desafiar a Nefarian.;;;;;;;;;x
hoa_enter_ahnqiraj;Enter the Temple of Ahn'Qiraj;Entrer dans le Temple d'Ahn'Qiraj;Den Tempel von Ahn'Qiraj betreten;;Entrar al Templo de Ahn'Qiraj;;;;;;;;;x
hoa_enter_ahnqiraj_desc;Behind the Gates of Ahn'Qiraj lies C'Thun, an Old God of unfathomable power. This may be suicide.;Derriere les Portes d'Ahn'Qiraj se cache C'Thun, un Dieu Tres Ancien d'une puissance insondable. C'est peut-etre du suicide.;Hinter den Toren von Ahn'Qiraj lauert C'Thun. Dies konnte Selbstmord sein.;;Detras de las Puertas de Ahn'Qiraj se esconde C'Thun. Esto podria ser suicidio.;;;;;;;;;x
hoa_enter_naxxramas;Enter Naxxramas;Entrer dans Naxxramas;Naxxramas betreten;;Entrar en Naxxramas;;;;;;;;;x
hoa_enter_naxxramas_desc;Assault the floating necropolis of Naxxramas to face the Archlich Kel'Thuzad himself. Only legends survive this.;Assaut de la necropole flottante de Naxxramas pour affronter l'Archliche Kel'Thuzad en personne. Seules les legendes en survivent.;Die schwebende Nekropole Naxxramas sturmen. Nur Legenden uberleben dies.;;Asaltar la necropolis flotante Naxxramas. Solo las leyendas sobreviven.;;;;;;;;;x
hoa_must_control_shadowfang_tt;Must control Silverpine Forest (Shadowfang Keep);Doit controler la Foret des Pins-Argentes (Shadowfang Keep);Muss Silberwald kontrollieren;;Debe controlar el Bosque de Argenteos;;;;;;;;;x
hoa_must_control_tirisfal_tt;Must control Tirisfal Glades (Scarlet Monastery area);Doit controler les Clairires de Tirisfal (zone du Monastere Ecarlate);Muss Tirisfal kontrollieren;;Debe controlar Claros de Tirisfal;;;;;;;;;x
hoa_must_control_gnomeregan_tt;Must control Gnomeregan (Dun Morogh);Doit controler Gnomeregan (Dun Morogh);Muss Gnomeregan kontrollieren;;Debe controlar Gnomeregan;;;;;;;;;x
hoa_must_control_maraudon_tt;Must control Maraudon (Desolace);Doit controler Maraudon (Desolace);Muss Maraudon kontrollieren;;Debe controlar Maraudon;;;;;;;;;x
hoa_must_control_dire_maul_tt;Must control Eldre'thalas (Feralas);Doit controler Eldre'Thalas (Feralas);Muss Eldre'Thalas kontrollieren;;Debe controlar Eldre'thalas;;;;;;;;;x
hoa_must_control_stratholme_tt;Must control Stratholme (Eastern Plaguelands);Doit controler Stratholme (Maleterres de l'Est);Muss Stratholme kontrollieren;;Debe controlar Stratholme;;;;;;;;;x
hoa_must_control_caer_darrow_tt;Must control Caer Darrow (Scholomance island);Doit controler Caer Darrow (ile de Scholomance);Muss Caer Darrow kontrollieren;;Debe controlar Caer Darrow;;;;;;;;;x
hoa_must_control_blackrock_tt;Must control Blackrock Spire;Doit controler le Pic Blackrock;Muss Blackrock Spitze kontrollieren;;Debe controlar Cumbre de Roca Negra;;;;;;;;;x
hoa_must_control_zulgurub_tt;Must control Zul'Gurub (Stranglethorn Vale);Doit controler Zul'Gurub (Val de Strangleronce);Muss Zul'Gurub kontrollieren;;Debe controlar Zul'Gurub;;;;;;;;;x
hoa_must_control_blackrock_depths_tt;Must control Blackrock Depths;Doit controler les Profondeurs de Blackrock;Muss Blackrock Tiefen kontrollieren;;Debe controlar Profundidades de Roca Negra;;;;;;;;;x
hoa_must_control_blackrock_spire_tt;Must control Blackrock Spire;Doit controler le Pic Blackrock;Muss Blackrock Spitze kontrollieren;;Debe controlar Cumbre de Roca Negra;;;;;;;;;x
hoa_must_control_ahnqiraj_tt;Must control Ahn'Qiraj (Silithus);Doit controler Ahn'Qiraj (Silithus);Muss Ahn'Qiraj kontrollieren;;Debe controlar Ahn'Qiraj;;;;;;;;;x
hoa_must_reach_dragonblight_tt;Must have access to Dragonblight (Northrend);Doit avoir acces a la Desolation des dragons (Norfendre);Muss Zugang zum Drachenoden haben;;Debe tener acceso a Cementerio de Dragones;;;;;;;;;x
hoa_mc_warning_tt;WARNING: The Molten Core is extremely dangerous. Expect casualties.;ATTENTION: Le Coeur du Magma est extremement dangereux. Attendez-vous a des pertes.;WARNUNG: Extrem gefahrlich.;;ADVERTENCIA: Extremadamente peligroso.;;;;;;;;;x
hoa_bwl_warning_tt;WARNING: Blackwing Lair is nearly impossible. Only the strongest survive.;ATTENTION: Le Repaire de l'Aile Noire est quasi-impossible. Seuls les plus forts survivent.;WARNUNG: Fast unmoglich.;;ADVERTENCIA: Casi imposible.;;;;;;;;;x
hoa_aq_warning_tt;WARNING: C'Thun is an Old God. Many will die.;ATTENTION: C'Thun est un Dieu Tres Ancien. Beaucoup mourront.;WARNUNG: C'Thun ist ein Alter Gott.;;ADVERTENCIA: C'Thun es un Dios Antiguo.;;;;;;;;;x
hoa_naxx_warning_tt;WARNING: Naxxramas is almost certain death. Only legends survive.;ATTENTION: Naxxramas est presque une mort certaine. Seules les legendes en survivent.;WARNUNG: Naxxramas ist fast sicherer Tod.;;ADVERTENCIA: Naxxramas es muerte casi segura.;;;;;;;;;x
hoa_entering_shadowfang_tt;You gather your champions and enter the cursed keep...;Vous rassemblez vos champions et entrez dans le chateau maudit...;Ihr versammelt eure Champions...;;Reunis a tus campeones y entras...;;;;;;;;;x
hoa_hakkar_slayer;Slayer of Hakkar;Pourfendeur d'Hakkar;Bezwinger von Hakkar;;Asesino de Hakkar;;;;;;;;;x
hoa_cthun_slayer;Slayer of C'Thun;Pourfendeur de C'Thun;Bezwinger von C'Thun;;Asesino de C'Thun;;;;;;;;;x
hoa_shadowfang_cleared;Shadowfang Keep Cleared;Shadowfang Keep Nettoye;Shadowfang Keep gesaubert;;Shadowfang Keep Limpiado;;;;;;;;;x
hoa_scarlet_monastery_cleared;Scarlet Monastery Cleared;Monastere Ecarlate Nettoye;Scharlachrotes Kloster gesaubert;;Monasterio Escarlata Limpiado;;;;;;;;;x
hoa_gnomeregan_cleared;Gnomeregan Cleared;Gnomeregan Nettoye;Gnomeregan gesaubert;;Gnomeregan Limpiado;;;;;;;;;x
hoa_maraudon_cleared;Maraudon Cleared;Maraudon Nettoye;Maraudon gesaubert;;Maraudon Limpiado;;;;;;;;;x
hoa_dire_maul_cleared;Dire Maul Cleared;Hache-Tripes Nettoye;Dusterbruch gesaubert;;Dire Maul Limpiado;;;;;;;;;x
hoa_stratholme_cleared;Stratholme Cleared;Stratholme Nettoye;Stratholme gesaubert;;Stratholme Limpiado;;;;;;;;;x
hoa_scholomance_cleared;Scholomance Cleared;Scholomance Nettoyee;Scholomance gesaubert;;Scholomance Limpiado;;;;;;;;;x
hoa_ubrs_cleared;Blackrock Spire Cleared;Pic Blackrock Nettoye;Blackrock Spitze gesaubert;;Cumbre de Roca Negra Limpiado;;;;;;;;;x
